{
  "key": "labWave",
  "derivedFrom": null,
  "loop": true,
  "duration": 48,
  "easing": "linear",
  "note": "An original raised-hand wave authored directly on SVGLab's fighter rig.",
  "keyframes": [
    {
      "frame": 0,
      "bones": {
        "torso": {
          "rotation": 0
        },
        "arm-front": {
          "rotation": 0
        },
        "forearm-front": {
          "rotation": 0
        }
      }
    },
    {
      "frame": 8,
      "bones": {
        "torso": {
          "rotation": -2
        },
        "arm-front": {
          "rotation": -105
        },
        "forearm-front": {
          "rotation": -30
        }
      }
    },
    {
      "frame": 16,
      "bones": {
        "torso": {
          "rotation": -2
        },
        "arm-front": {
          "rotation": -115
        },
        "forearm-front": {
          "rotation": 25
        }
      }
    },
    {
      "frame": 24,
      "bones": {
        "torso": {
          "rotation": -2
        },
        "arm-front": {
          "rotation": -105
        },
        "forearm-front": {
          "rotation": -25
        }
      }
    },
    {
      "frame": 32,
      "bones": {
        "torso": {
          "rotation": -2
        },
        "arm-front": {
          "rotation": -115
        },
        "forearm-front": {
          "rotation": 25
        }
      }
    },
    {
      "frame": 40,
      "bones": {
        "torso": {
          "rotation": -2
        },
        "arm-front": {
          "rotation": -105
        },
        "forearm-front": {
          "rotation": -25
        }
      }
    },
    {
      "frame": 48,
      "bones": {
        "torso": {
          "rotation": 0
        },
        "arm-front": {
          "rotation": 0
        },
        "forearm-front": {
          "rotation": 0
        }
      }
    }
  ]
}
